{
  "protocol_version": "cpo-contracts@0.1.0",
  "type": "STATE_STALENESS",
  "severity": "low",
  "requires_review": true,
  "detected_in_state_snapshot_id": "STATE-EXAMPLE-001",
  "signal": {
    "dedup_key": "STATE_STALENESS:2026-01-25T12:00:00Z",
    "scan_now": "2026-01-25T12:00:00+00:00",
    "window_end_bucket": "2026-01-25T12:00:00Z",
    "observations": {
      "failure_count": 3
    }
  }
}